{
  "schema_version": "recipe/v1",
  "revision": 1,
  "format": "yaml",
  "dialect": "yaml-1.2.2",
  "generator": "generators/yaml/spec14_boundaries.py",
  "profile": "yamlprims-core-depth128",
  "profile_revision": 1,
  "classifiers": {
    "sensitivity": "0-public",
    "access-tier": "public"
  },
  "provenance": {
    "origin": "synthetic",
    "license": "MIT OR Apache-2.0",
    "method": "Generated for structcorpus from the published yamlprims specification revision 1.4, sections 5.2, 5.4, 6, and 7.1."
  },
  "id": "depth-boundaries",
  "parameters": {
    "set": "depth",
    "limit_max_input_bytes": 65536,
    "limit_max_depth": 128,
    "limit_max_nodes": 512,
    "limit_max_expanded_nodes": 16,
    "limit_max_alias_events": 16,
    "limit_max_owned_bytes": 65536,
    "limit_max_scalar_bytes": 1024,
    "limit_max_key_bytes": 1024,
    "limit_max_mapping_entries": 16,
    "limit_max_documents": 4,
    "limit_max_output_bytes": 65536,
    "limit_max_warnings": 16
  },
  "execution": {
    "tier": "smoke",
    "max_cases": 100,
    "max_output_bytes": 16777216
  },
  "expected": {
    "cases": 6,
    "input_bytes": 1584,
    "digest": "sha256:a0d10db9efa133b50e7fe437ba35daf7008100d01274a82733a344dd75a003e8"
  },
  "review": {
    "status": "provisional",
    "author": "devlead",
    "rationale": "Section 6 rows at max_depth 128. S_127(0) and S_128(0) load. S_129(0) fails max_depth at the 129th bracket. Alias k of 125 and 126 load. Alias k of 127 has source level 128 and fails placement at 129. Other budgets stay above the row, including a counted copy. Each input ends with one LF."
  }
}
