{
  "schema_version": "recipe/v1",
  "revision": 1,
  "format": "yaml",
  "dialect": "yaml-1.2.2",
  "generator": "generators/yaml/core_goldens.py",
  "profile": "yamlprims-core",
  "profile_revision": 2,
  "classifiers": {
    "sensitivity": "0-public",
    "access-tier": "public"
  },
  "provenance": {
    "origin": "synthetic",
    "license": "MIT OR Apache-2.0",
    "method": "Hand-written for structcorpus from the published yamlprims specification revision 1.1, sections 4, 5, and 8; each expected value is written out, not computed."
  },
  "id": "core-goldens-spec11",
  "parameters": {
    "merge_policy": "reject"
  },
  "execution": {
    "tier": "smoke",
    "max_cases": 500,
    "max_output_bytes": 16777216
  },
  "expected": {
    "cases": 116,
    "input_bytes": 1462,
    "digest": "sha256:b9bb203b4cfd5653dc3f8e0c2eac952f10549c8bd7de4fb0f5c379c9bf23f01a"
  },
  "review": {
    "status": "provisional",
    "author": "devlead",
    "rationale": "Hand-checked boundary goldens under the default profile: Core booleans, nulls and numbers, explicit and non-core tags, key equality and duplicates, merge rejection, aliases, document count, and typed targets. Bound to the revision 1.1 profile; expectations are unchanged from the revision 1.0 recipe because no input in this set is affected by 1.1/E-1 to E-4."
  }
}
