{
  "schema_version": "recipe/v1",
  "revision": 1,
  "format": "yaml",
  "dialect": "yaml-1.2.2",
  "generator": "generators/yaml/core_truth.py",
  "profile": "yamlprims-core",
  "profile_revision": 1,
  "classifiers": {
    "sensitivity": "0-public",
    "access-tier": "public"
  },
  "provenance": {
    "origin": "synthetic",
    "license": "MIT OR Apache-2.0",
    "method": "Generated for structcorpus from the published yamlprims specification revision 1.0, sections 4 and 5.1."
  },
  "id": "core-truth-booleans",
  "parameters": {
    "family": "booleans"
  },
  "execution": {
    "tier": "conformance",
    "max_cases": 60000,
    "max_output_bytes": 134217728
  },
  "expected": {
    "cases": 41154,
    "input_bytes": 695541,
    "digest": "sha256:331b4b393d4384f682f31ffabf6d1fa83f81c866eb36512b564a6ff1afd86af1"
  },
  "review": {
    "status": "provisional",
    "author": "devlead",
    "rationale": "Every case variant of true/false/null and YAML 1.1 words across eight positions, nine scalar styles, and six tags; block scalars in flow context or as implicit keys are syntax errors."
  }
}
