{
  "schema_version": "recipe/v1",
  "revision": 1,
  "format": "yaml",
  "dialect": "yaml-1.2.2",
  "generator": "generators/yaml/resource_ladders.py",
  "profile": "yamlprims-core",
  "profile_revision": 3,
  "classifiers": {
    "sensitivity": "0-public",
    "access-tier": "public"
  },
  "provenance": {
    "origin": "synthetic",
    "license": "MIT OR Apache-2.0",
    "method": "Generated for structcorpus from YAML 1.2.2 and the published yamlprims specification revision 1.3, sections 5.4 and 6."
  },
  "id": "ladder-alias-fanout",
  "parameters": {
    "set": "alias-fanout",
    "sizes": "10,100,1000,10000"
  },
  "execution": {
    "tier": "stress",
    "max_cases": 100,
    "max_output_bytes": 268435456,
    "hazards": [
      "alias-expansion"
    ],
    "budgets": {
      "wall_ms": 2000,
      "memory_bytes": 536870912,
      "output_bytes": 65536
    }
  },
  "expected": {
    "cases": 4,
    "input_bytes": 44740,
    "digest": "sha256:498f596b1a4c8232d3a201c8052e51442b5c55b3bb364ca54f9e97264a47bb5f"
  },
  "review": {
    "status": "provisional",
    "author": "devlead",
    "rationale": "One 64-byte anchored scalar aliased 10 to 10,000 times. Only format-level events are expected; time and memory are measured."
  }
}
