{
  "schema_version": "recipe/v1",
  "revision": 1,
  "format": "yaml",
  "dialect": "yaml-1.2.2",
  "generator": "generators/yaml/tag_trees.py",
  "profile": "yamlprims-core-limits",
  "profile_revision": 1,
  "classifiers": {
    "sensitivity": "0-public",
    "access-tier": "public"
  },
  "provenance": {
    "origin": "synthetic",
    "license": "MIT OR Apache-2.0",
    "method": "Generated for structcorpus from the published yamlprims specification revision 1.1, section 6, with the limits of the yamlprims-core-limits r1 profile."
  },
  "id": "tag-trees-limits",
  "parameters": {
    "set": "limits",
    "max_nodes": 64,
    "max_owned_bytes": 8192
  },
  "execution": {
    "tier": "smoke",
    "max_cases": 500,
    "max_output_bytes": 16777216
  },
  "expected": {
    "cases": 6,
    "input_bytes": 17133,
    "digest": "sha256:3a9e536ad590415375c75b937e5513fc0f2b87042a6357d67cdcfd338c903e18"
  },
  "review": {
    "status": "provisional",
    "author": "devlead",
    "rationale": "Inputs whose node count or owned-byte weight is one below, equal to, and one above the profile's max_nodes and max_owned_bytes, where each retained shorthand tag is a wrapper node weighing 64 plus its uri, handle, and suffix bytes. Only the input above the limit fails, with that limit named."
  }
}
