{
  "schema_version": "recipe/v1",
  "revision": 1,
  "format": "yaml",
  "dialect": "yaml-1.2.2",
  "generator": "generators/yaml/resource_ladders.py",
  "profile": "yamlprims-core",
  "profile_revision": 3,
  "classifiers": {
    "sensitivity": "0-public",
    "access-tier": "public"
  },
  "provenance": {
    "origin": "synthetic",
    "license": "MIT OR Apache-2.0",
    "method": "Generated for structcorpus from YAML 1.2.2 and the published yamlprims specification revision 1.3, sections 5.4 and 6."
  },
  "id": "ladder-depth",
  "parameters": {
    "set": "depth",
    "sizes": "8,9,64,128,129,255,256,1024"
  },
  "execution": {
    "tier": "stress",
    "max_cases": 100,
    "max_output_bytes": 268435456,
    "hazards": [
      "deep-nesting"
    ],
    "budgets": {
      "wall_ms": 2000,
      "memory_bytes": 536870912,
      "output_bytes": 65536
    }
  },
  "expected": {
    "cases": 8,
    "input_bytes": 3762,
    "digest": "sha256:1f80e9e268176a82acb9d137b36764f8ec4d8611a4b20001bb701e0555867041"
  },
  "review": {
    "status": "provisional",
    "author": "devlead",
    "rationale": "Nested flow sequences 8 to 1,024 deep around one scalar. Only format-level events are expected: specification 1.3 does not define how load depth is counted against max_depth, so no limit expectation is recorded."
  }
}
