{
  "schema_version": "recipe/v1",
  "revision": 1,
  "format": "yaml",
  "dialect": "yaml-1.2.2",
  "generator": "generators/yaml/core_truth.py",
  "profile": "yamlprims-core",
  "profile_revision": 1,
  "classifiers": {
    "sensitivity": "0-public",
    "access-tier": "public"
  },
  "provenance": {
    "origin": "synthetic",
    "license": "MIT OR Apache-2.0",
    "method": "Generated for structcorpus from the published yamlprims specification revision 1.0, sections 4 and 5.1."
  },
  "id": "core-truth-numbers",
  "parameters": {
    "family": "numbers"
  },
  "execution": {
    "tier": "smoke",
    "max_cases": 1000,
    "max_output_bytes": 16777216
  },
  "expected": {
    "cases": 375,
    "input_bytes": 6855,
    "digest": "sha256:21312be9809582115c0c48e2ffa507e53c9e0b875b530d32002a3350ec275a2a"
  },
  "review": {
    "status": "provisional",
    "author": "devlead",
    "rationale": "Integer and float resolution for sign, base, range, overflow, underflow, non-finite, and binary32-threshold texts in plain, quoted, and tagged forms."
  }
}
