{
  "schema_version": "recipe/v1",
  "revision": 1,
  "format": "yaml",
  "dialect": "yaml-1.2.2",
  "generator": "generators/yaml/core_goldens.py",
  "profile": "yamlprims-core-merge-as-key",
  "profile_revision": 1,
  "classifiers": {
    "sensitivity": "0-public",
    "access-tier": "public"
  },
  "provenance": {
    "origin": "synthetic",
    "license": "MIT OR Apache-2.0",
    "method": "Hand-written for structcorpus from the published yamlprims specification revision 1.0, sections 4, 5, and 8; each expected value is written out, not computed."
  },
  "id": "core-goldens-merge-as-key",
  "parameters": {
    "merge_policy": "as-key"
  },
  "execution": {
    "tier": "smoke",
    "max_cases": 500,
    "max_output_bytes": 16777216
  },
  "expected": {
    "cases": 1,
    "input_bytes": 25,
    "digest": "sha256:735b41bf63fdaf1982c1b8604a42a666f883617db40ede8edd5878cfe633551b"
  },
  "review": {
    "status": "provisional",
    "author": "devlead",
    "rationale": "Hand-checked merge golden with a recognized directive kept as the ordinary key '<<'."
  }
}
