{
  "schema_version": "recipe/v1",
  "revision": 1,
  "format": "yaml",
  "dialect": "yaml-1.2.2",
  "generator": "generators/yaml/core_goldens.py",
  "profile": "yamlprims-core-merge-apply",
  "profile_revision": 1,
  "classifiers": {
    "sensitivity": "0-public",
    "access-tier": "public"
  },
  "provenance": {
    "origin": "synthetic",
    "license": "MIT OR Apache-2.0",
    "method": "Hand-written for structcorpus from the published yamlprims specification revision 1.0, sections 4, 5, and 8; each expected value is written out, not computed."
  },
  "id": "core-goldens-merge-apply",
  "parameters": {
    "merge_policy": "apply"
  },
  "execution": {
    "tier": "smoke",
    "max_cases": 500,
    "max_output_bytes": 16777216
  },
  "expected": {
    "cases": 8,
    "input_bytes": 261,
    "digest": "sha256:df8b0071fee58c46dec8c5d285c2ce8cc6891ec701ec9e77caf6f83f3cc269aa"
  },
  "review": {
    "status": "provisional",
    "author": "devlead",
    "rationale": "Hand-checked merge goldens with merge keys applied: precedence of explicit keys, source order, sequence sources, malformed and repeated directives, and quoted or string-tagged '<<'."
  }
}
